{
  "$schema": "http://json-schema.org/draft-07/schema#",
  "title": "Character",
  "description": "Authored character definition for the thought/dialogue system.",
  "type": "object",
  "required": ["id", "displayName"],
  "additionalProperties": false,
  "properties": {
    "$schema": { "type": "string" },
    "id": { "type": "string", "description": "Stable unique id." },
    "displayName": { "type": "string" },
    "gender": { "enum": ["male", "female", "neutral", "object"] },
    "canonical": { "type": "boolean", "description": "Fixed-history character; major random events never touch them." },
    "traits": { "type": "array", "items": { "type": "string" }, "description": "Trait ids from TraitLibrary." },
    "moods": { "type": "array", "items": { "$ref": "#/definitions/mood" } },
    "talkPolicies": { "type": "array", "items": { "$ref": "#/definitions/talkPolicy" } },
    "relationships": { "type": "array", "items": { "$ref": "#/definitions/relationship" } },
    "knowledge": { "type": "array", "items": { "$ref": "#/definitions/knowledge" } },
    "notes": { "type": "array", "items": { "type": "string" }, "description": "Always injected into the LLM context." },
    "examples": { "type": "array", "items": { "type": "string" }, "description": "Voice lines used as tone references in the system prompt. Never injected verbatim as text to repeat, so they must read as real spoken sentences (no meta notes like 'Catch phrase:')." },
    "thoughts": { "type": "array", "items": { "$ref": "#/definitions/thought" } }
  },
  "definitions": {
    "mood": {
      "type": "object",
      "required": ["id"],
      "additionalProperties": false,
      "properties": {
        "id": { "type": "string", "examples": ["normal", "depressed"] },
        "valenceCenter": { "type": "number", "minimum": 0, "maximum": 1 },
        "traits": { "type": "array", "items": { "type": "string" } },
        "sample": { "type": "string", "description": "One clean line in this mood's voice. Injected as a tone reference only; the model is told never to reuse it verbatim. Keep it free of annotations like (x5); a non-verbal cue such as *sigh* is allowed." }
      }
    },
    "talkPolicy": {
      "type": "object",
      "required": ["nodeId", "policy"],
      "additionalProperties": false,
      "properties": {
        "nodeId": { "type": "string", "description": "Taxonomy node id; applies to descendants." },
        "policy": { "enum": ["Open", "Reluctant", "Secretive", "Unknown", "Enthusiastic"] }
      }
    },
    "relationship": {
      "type": "object",
      "required": ["personName", "nodeId"],
      "additionalProperties": false,
      "properties": {
        "personId": { "type": "string" },
        "personName": { "type": "string" },
        "label": { "type": "string", "examples": ["mother", "father", "friend"] },
        "nodeId": { "type": "string", "examples": ["relationships/family/mother"] },
        "opinion": { "type": "number", "minimum": 0, "maximum": 1 },
        "notes": { "type": "array", "items": { "type": "string" }, "description": "Authored facts injected into the LLM context." }
      }
    },
    "knowledge": {
      "type": "object",
      "required": ["key", "value"],
      "additionalProperties": false,
      "properties": {
        "key": { "type": "string" },
        "value": { "type": "string" },
        "nodeId": { "type": "string" }
      }
    },
    "thought": {
      "type": "object",
      "required": ["nodeId", "subject"],
      "additionalProperties": false,
      "properties": {
        "nodeId": { "type": "string" },
        "subject": { "type": "string" },
        "sentiment": { "type": "number", "minimum": -1, "maximum": 1 },
        "impact": { "type": "number", "minimum": 0, "maximum": 1 },
        "decay": { "type": "number", "minimum": 0, "maximum": 1, "description": "Fraction of strength lost per in-game day." },
        "ageDays": { "type": "number", "minimum": 0 },
        "rawLabel": { "type": "string" },
        "detail": { "type": "string" },
        "tags": { "type": "array", "items": { "type": "string" } }
      }
    }
  }
}
